keyword,monetize,product,status
50代 副業 始め方 初心者,スクールアフィリ,ショート動画CAMP,
50代 在宅ワーク おすすめ 女性,居宅ワーク ASP,クラウドワークス,
Claude 使い方 初心者 50代,Claudeアフィリ,Claude Pro,
53歳 自己破産 立て直し 副業,スクールアフィリ,ショート動画CAMP,
50代 AI ショート動画 作り方,スクールアフィリ,ショート動画CAMP,
電話占い おすすめ 初回 登録 無料,電話占いアフィリ,電話占いウィル,
50代 ポイ活 スマホ だけ,ポイ活 ASP,ハピタス,
車中泊 初心者 必要なもの 50代,Amazon物販,車中泊グッズセット,
退職代行 使ってみた 50代,居宅ワーク ASP,退職代行EXIT,
50代 TikTok 始め方 稼ぐ,スクールアフィリ,ショート動画CAMP,
ショート動画 稼ぐ 仕組み 初心者,スクールアフィリ,ショート動画CAMP,
50代 雇用保険 切れた 次 どうする,居宅ワーク ASP,クラウドワークス,
50代 夢 キャンピングカー 費用,Amazon物販,ポータブル電源,
AI動画 生成 無料 使い方 初心者,Claudeアフィリ,Claude Pro,
50代 ブログ 収益化 アドセンス,AdSense情報,Xサーバー,
